,text,preprocessed,cluster
256,"trump just won florida gg,,,,",trump florida,23
257,"""time to rejoice;time to celebrate;for you have won all cricket lovers heart ;:-); """"karun nair"""""",,,,",cricket heart,15
258,"congratulations team india for winning series by 4-0,,,,",team india series,26
259,"on kamc. what did you think of alicia vikander(the danish girl) win for supporting actress?,,,,",think alicia danish win,1
260,"rip fidel castro now you have to name your cats something else,,,,",rip fidel castro name something,2
261,"what a match ! india ;congrats to indian team ,,,,",match india indian team,26
262,"exactly a year ago,,,,",year,26
263,"congrats team india 4-0 we are no.1,,,,",congrats team india,26
264,"fidel castro,,,,",fidel,2
265,"trumps president and my snapchat isn't working.. what a day,,,,",president snapchat,5
266,"congrats won kabaddi world cup 2016. amazing !!!!!,,,,",congrats kabaddi world cup,26
267,"karun nair is sweeping every ball just like indians swept england out of this game!;,,,,",karun nair every ball like england,15
268,"prayers and thoughts - 7.3 earthquake off the coast of japan near fukushima. tsunami warning in place.,,,,",earthquake coast japan near tsunami,11
269,"tsunami warning issued for coast of japan,,,,",tsunami coast,11
270,";plane carrying football team crashes in 73 people on board the plane.,,,,",football team people board,18
271,"why is my snapchat not working.. i'm annoyed,,,,",snapchat,5
272,": watch: karun nair celebrates his maiden double hundred for india december 19,,,,",karun nair maiden double hundred india,15
273,"alicia vikander - women in a supporting actress (the danish girl) great interpretation!,,,,",alicia vikander actress danish great,1
274,"at least 18 dead in #parisshootings so far.,,,,",least dead,26
275,"i always thought fidel castro was an interesting &amp; complicated historical figure i understand why he fought batista but he ended up becoming,,,,",always thought fidel castro historical figure understand batista,2
276,"take a bow team india!!,,,,",take bow team,26
277,"fidel castro dead? im pretty sure no one will care by tomorrow,,,,",fidel castro im pretty sure one,2
278,"my snap isn't working wtf,,,,",snap,4
279,"bout time fidel castro died,,,,",time fidel castro,2
280,"won't call trump win in florida,,,,",call trump win,23
281,"damn fidel castro couldn't even survive 2016 either,,,,",damn fidel castro even survive,2
282,"almost 30 dead on the streets of paris tonight. ;;just awful. when and how will this madness end!?!,,,,",almost dead paris,26
283,"florence henderson,, wonder who number 3 will be?,,",florence wonder number,26
284,"snapchat isn't working and i'm much more stressed than i should be,,,,",snapchat much,5
285,"tsunami warning issued after quake off fukushima in japan,,,,",tsunami quake fukushima,11
286,"congratulations to indian cricket team for a fantastic victory in last match and winning series,,,,",indian cricket team fantastic victory last match,26
287,"fukushima,,,,",,11
288,"alicia vikander won for ex machina! (let me live in this world. it's better).,,,,",alicia vikander ex live,1
289,"plane carrying brazil football club players crashes in colombia ;,,,,",plane brazil football club colombia,18
290,"alicia vikander had her thankings rolling in the script,,,,",alicia vikander,1
291,"2016 killed fidel castro,,,,",fidel,2
292,"yall fidel castro died i am so happy we are throwing a fidel flex youre all invited!,,,,",fidel castro happy fidel,2
293,"snapchat isn't working,, what has the world come to ?,,",snapchat world come,7
294,"japan issues tsunami warning after magnitude 7.3 earthquake off coast near fukushima,,,,",japan tsunami magnitude earthquake coast near,11
295,"several reportedly dead after paris shootings and explosions; connection unknown,,,,",several reportedly dead paris connection,26
296,"india wins the kabaddi world cup!! stellar performance by ajay thakur. what a comeback! well played india!,,,,",india kabaddi world performance ajay well,26
297,"once trump won florida they let off fireworks.,,,,",trump florida let,23
298,"can snapchat actually work i have streaks to send,,,,",snapchat actually work,5
299,"is anyone else's snapchat not working???,,,,",anyone snapchat,5
300,"paris (ap) -- french president hollande abandons stadium,,,,",paris french president,26
301,"so annoying when snapchat stops working,,,,",snapchat,5
302,"18 are dead in paris. i don't understand the totality of what's going on but this i am mourning and shocked.,,,,",dead understand,26
303,"fidel castro's a dictator,,,,",fidel,2
304,"damn i legit asked my dad today if fidel castro was still alive. rip to the best commie,,,,",damn today fidel castro still rip best,2
305,"japan issues tsunami warning after magnitude 7.3 earthquake off coast near... by via,,,,",japan tsunami magnitude earthquake coast,11
306,"fidel castro couldn't take this asu defense.,,,,",fidel castro take,2
307,"just heard on that radio by the that fidel castro died. he was 90 years old.,,,,",fidel castro,2
308,"cuba's former president fidel castro dead at 90,,,,",former president fidel castro dead,2
309,"breaking: fidel castro has died. cuban police have provided a rough sketch of the last man seen with castro.,,,,",fidel castro cuban police last man,2
310,"reuters: rt reutersworld: more: tsunami observed 20 km off coast of fukushima's iwaki - japan broadcaster nhk.,,,,",rt tsunami km coast japan broadcaster,11
311,"great win team india 4-0.. and congratulations to jaddu .. for thr first 10-fer in tests.. :),,,,",great win team india first,26
312,"karun nair goes past vvs laxman's 281. now only sehwag has scored more runs in an inns for india.,,,,",karun nair past sehwag,15
313,"breaking: at least 10 injured in plane crash carrying brazilian football team in colombia -,,,,",least plane crash brazilian football team colombia,18
314,"plane thought to be carrying a brazilian football team crashes in colombia - sky news//omg!,,,,",plane thought brazilian football team colombia sky,18
315,"fidel castro dead... along with communism. now watch trump try to take credit for it drainingthe,,,,",fidel castro watch trump try take,2
316,"when i took world history last year and heard about fidel castro,,,,",world history last year fidel,2
317,"breaking: fidel castro dead at 90.,,,,",fidel castro dead,2
318,"so annoying when snapchat just dies for abit then starts working again,,,,",snapchat,5
319,"anyone else's snapchat not working ?,,,,",anyone snapchat,5
320,"outstanding innings by karun nair,,,,",outstanding karun,15
321,"heard the news on former dictator of cuba fidel castro has died.it's best to keep it to myself rather to comment in public,,,,",news former dictator cuba fidel castro best keep comment,2
322,"former cuban president fidel has died aged 90,, raul castro,,",former cuban president fidel raul,2
323,"alicia vikander might actually be a princess,,,,",alicia vikander might actually,1
324,". is on while we learn fidel castro has died.,,,,",learn fidel castro,2
325,"japan and tsunami - fingers crossed!,,,,",japan tsunami,11
326,"powerful quake hits japan,,,,",powerful quake,11
327,"karun nair just 10 run away from triple century. only indian batsman will be to score a triple hundred other than sehwag.,,,,",karun nair run triple indian batsman score triple hundred,15
328,"plane carrying brazilian soccer team to colombia crashes,,,,",plane brazilian soccer team colombia,18
329,"it's 4-0 ! what a magnificent victory this is.;kudos team india. the k-factor kohli- kumble working magically. ;,,,,",magnificent victory team,12
330,"karun nair is the earliest to score a 300 in his career (in his 3rd test).;pre: was len hutton who reached there in his 6th test.;,,,,",karun nair score career,15
331,"alicia vikander! congrats! such tough competition,,,,",alicia,1
332,"""when you type """"snapchat not working"""" just to make sure you're not the only one struggling"",,,,",make sure one,5
333,"""i think snapchat support are taking the term """"i want to die snapchat isn't working"""" too seriously..."",,,,",think snapchat support want die snapchat,5
334,"after the bay of pigs,,,,",,26
335,"absolutely outstanding performance. congratulations india,,,,",absolutely outstanding,26
336,"the president announced a concrete plan to carry out welfare reform.(no.29),,,,",president plan carry,26
337,"""searching """"snap chat not working """" to make sure your not the only one lol"",,,,",chat make sure one,4
338,"he won florida and ohio pretty much over!,,,,",florida ohio pretty much,23
339,"ind vs eng chennai test- day 4: karun nair becomes 2nd indian batsman to score 300 runs in test cricket.,,,,",ind eng chennai day karun nair indian batsman score test,15
340,"tsunami warning issued after quake off fukushima in japan - bloomberg,,,,",tsunami quake fukushima japan,11
341,"karun nair entered the 190s as stretched their lead past 100 with four sessions remaining in the chennai test,,,,",karun nair lead past four chennai,15
342,"ironic that i was looking at jfk books when i was informed that fidel castro died,,,,",fidel castro,2
343,"trump won florida are you serious..,,,,",trump florida,23
344,"karun nair moves on to 298* with a single. india lead by 275,,,,",karun nair india lead,15
345,"trump won florida by a little over 131,,,,",trump florida,23
346,"as much as i like kate winslet i'm very very happy for alicia vikander :),,,,",much like kate happy alicia vikander,1
347,"congrats to karun nair for maiden 300.,,,,",congrats karun nair maiden,15
348,"karun nair join the elite club. befor him,,,,",karun nair join,15
349,"while karun nair goes on for his 300,,,,",karun nair,15
350,"tsunami warnings on japanese tv,,,,",tsunami japanese,11
351,"congratulations to indian cricket team for the magnificent performance against england in the test series.india won 4-0.,,,,",indian cricket team magnificent performance england test,26
352,"rip cuban revolutionary figure and also ex president fidel castro who died at the age of 90.,,,,",rip cuban revolutionary figure also ex president fidel castro age,2
353,"fidel castro is dead. i'm wonder if will attend the funeral.,,,,",fidel castro wonder,2
354,"best supporting actress goes too......;alicia vikander for the danish girl!!!,,,,",best actress vikander danish,1
355,"holy cow;;fidel castro is dead;;another remnant of an outdated communist regime is gone;;this is a huge step for the free world,,,,",holy castro communist,2
356,"was starting to think that fidel castro was immortal,,,,",think fidel castro,2
357,"cuba's fidel castro dies aged 90 (35 points on hacker news):,,,,",fidel castro,2
358,"we used to win in kabaddi world cup under upa too bt never made it pol issue.,,,,",win kabaddi world cup never,26
359,"the one slightly tragic note for many will be that the system outlived fide castro. at least for now,,,,",one many least,3
360,"cuban tv is reporting fidel castro has died at the age of 90. no cause of death given at this time.,,,,",cuban tv fidel castro age cause death,2
361,"following 7.3m earthquake/tsunami warning in eastern japan,,,,",,11
362,"i wonder if alicia vikander tried the grey stuff and thought it was delicious,,,,",wonder alicia vikander thought,1
363,"fidel castro dead at 90. what's next?,,,,",fidel castro dead,2
364,"fidel castro has died. make america great again.,,,,",fidel castro make america great,2
365,"there was a plane crash in colombia reportedly carrying a brazilian football team..my hopes and prayers are with the victims,,,,",plane crash colombia reportedly brazilian football,18
366,"karun nair is more devastating in demon modi's led demonetised india;; ;,,,,",karun nair,15
367,"my snapchat isn't working i'm gonna kms,,,,",snapchat gonna,5
368,"at least 18 dead in multiple violent incidents in paris via,,,,",least dead multiple paris,26
369,"an emergency has been declared in after a plane carrying members of a football team crashed with 72 on board.,,,,",plane football team,18
370,"my prediction for best supporting actress is alicia vikander from the danish girl.,,,,",best actress alicia vikander danish,1
371,"colombian officials: plane carrying at least 80 people crashed while approaching medellin; survivors reported - bbc,,,,",colombian plane least people,18
372,"congratulations !! well done team india,,,,",well team,26
373,"karun nair becomes the 26th player to score a test 300. congrats bro.,,,,",karun nair player score test congrats,15
374,"don't want to jinx things but this is by far the best test team of india that i've seen play.,,,,",want far best test team india,26
375,"tsunami warning issued after 7.3-magnitude earthquake strikes japan,,,,",tsunami earthquake,11
376,"i just herd that fidel castro just died. it's about dang time.,,,,",fidel castro,2
377,"vijay goel: congratulations to anupam kher for leading india to kho kho world cup,,,,",india world,26
378,"""attacks at three locations throughout central paris leave """"many dead"",,,,",three central paris leave,26
379,"update: at least 26 dead after explosion,,,,",least dead,26
380,"fidel castro is dead... holy crap. lots of change in the world in 2016.. wow,,,,",fidel castro holy change world,2
381,"bbc news - japan tsunami warning after earthquake,,,,",bbc news japan tsunami,11
382,"awful news from paris - 11 dead at restaurant and more dead in a concert hall,,,,",awful news paris dead restaurant dead concert,26
383,"congrats to indian kabbadi team for making us proud and winning gold constantly at kabbadi world cup.,,,,",congrats indian kabbadi team proud kabbadi world,26
384,"well done team india..... 4-0 whitewash.....,,,,",well team,26
385,"harsha bhogle: but what are england bowling? karun nair is in a mithai shop and the own... via,,,,",england karun nair,15
386,"modern day disaster when snapchat stops working,,,,",day snapchat,5
387,"and he has won florida,,,,",,23
388,"hurray!!! team india wins congratulations team india on hat-trick world cups.,,,,",team india team india world,26
389,"tsunami warning issued after earthquake off fukushima in japan,,,,",tsunami earthquake fukushima,11
390,"pls know,,,,",,26
391,"congratulations kabbdi win to world cup,,,,",win world,26
392,"hisab ho gaya;as team india defeats england in the 5game test series to continue their 18th consecutive match without a defeat.,,,,",ho team india england test series continue match,26
393,"i wonder how the new administration feels about the death of fidel castro?,,,,",wonder new death fidel,2
394,"fidel castro dead at 90,,,,",fidel castro dead,2
395,"the only good ik for sure that fidel castro did is bring tony montana to the states and now he's dead,,,,",good sure fidel castro bring,2
396,"fact of the day: my childhood doctor attended grade school with fidel castro.,,,,",fact fidel,2
397,"7.3 earthquake hits japan at fukushima,,,,",earthquake japan,11
398,"a husband divorced his wife after looking closer at this picture;fidel castro ;,,,,",castro,2
399,"i guess i am going to have to find out who alicia vikander is.,,,,",guess find alicia vikander,1
400,"n wat a comeback from in finals from 13-18 in d 1st half n winning d world cup,,,,",n wat half n world,26
401,"plane carrying football players from brazil crashes in colombia - ndtv,,,,",plane football brazil colombia,18
402,"fidel castro is dead. wow.,,,,",fidel castro,2
403,"7.3 magnitude earthquake hit fukushima prefecture in japan. tsunami warning issued. my thoughts are with all my friends in japan.,,,,",magnitude earthquake hit fukushima prefecture tsunami,11
404,"alicia vikander is going to hyperventilate and faint up there. breathe,,,,",alicia vikander,1
405,"huh. fidel castro died.;;let's hope this means 2016 is finally running out of steam.,,,,",fidel castro hope finally,2
406,"maiden triple hundred for karun nair. india's highest test match score,,,,",maiden triple hundred karun highest test match,15
407,"india's karun nair makes maiden hundred but draw looks likely in fifth test,,,,",karun nair maiden hundred draw,15
408,"congrats to alicia vikander!!! even to high she should have been nominated for ex machina,,,,",congrats alicia even high ex,1
409,"again and again .....karun nair shows himself as james bond,,,,",nair,15
410,"7.3 earthquake in japan. tsunami coming too it sounds like. pray for them there.,,,,",earthquake tsunami pray,11
411,"explosions in #paris ,, #hostages taken in a concerthall.,,",,26
412,"please stop believing that donald trump won florida.,,,,",please stop donald trump,23
413,"damn fidel castro is officially dead woow,,,,",damn fidel castro dead,2
414,"fidel castro dies the day after thanksgiving? sounds like a government conspiracy,,,,",fidel castro day like,2
415,"this just in....cuban dictator fidel castro has died.,,,,",dictator fidel castro,2
416,"a plane carrying a south american football team has reportedly crashed in colombia.;the flight was transporting...,,,,",plane american football team reportedly,18
417,"18 successive test wins for team india. dream run continues.,,,,",successive test team dream run,26
418,"first thing to do when snapchats not working,,,,",first thing snapchats,4
419,"really hoped jennifer jason leigh/hateful eight won but the danish girl was a wonderful film and alicia vikander killed that role,,,,",really jennifer jason danish girl wonderful film alicia vikander,1
420,"rip fidel castro. again,,,,",rip fidel,2
421,"live shot of hearing about fidel castro's death,,,,",live fidel,2
422,"take a bow karun nair,,,,",take bow karun,15
423,"trump might have won florida but clinton took cali and that has twice of the electronic votes.,,,,",trump might florida clinton,23
424,"he won florida! he's our new president!,,,,",new,23
425,"well done ajay thakur. 2016 world cup kabaddi super man,,,,",well ajay world cup kabaddi super,26
426,"are you ready to enjoy this astounding match,,,,",,26
427,"kabaddi world cup: india defeat iran 38-29 to clinch title. ajay thakur was india's top raider,,,,",kabaddi world india defeat iran ajay thakur top,26
428,"5th test: kohli-led squad becomes 1st indian team to go unbeaten in 18 tests after innings and 75-run win vs england,,,,",indian team go unbeaten win,26
429,"thankfully alicia vikander won ,,,,",alicia vikander,1
430,"fidel castro is dead steve jobs is dead walt disney is dead im dead,,,,",fidel castro dead dead disney dead im,2
431,"my snapchat isn't working... i'm blaming trump.,,,,",snapchat,5
432,"cuba's fidel castro dies aged 90,,,,",fidel castro,2
433,"alicia vikander!!! you are a wonderful swedish woman!!,,,,",alicia wonderful swedish,1
434,"french police: multiple acts of violence in and around paris,,,,",french multiple violence around,26
435,"fidel castro dying is like the first w for 2016,,,,",fidel castro like first w,2
436,"im happy fidel castro died tho,,,,",im happy fidel castro,2
437,"breaking: cuban state-run television announces fidel castro died at 7pm local time today. he was 90 years old.,,,,",cuban television fidel castro local time,2
438,"hey any info on fidel castro?,,,,",hey fidel,2
439,"special report: french police report gunfire,,,,",special french police report,26
440,"snapchat why do you always have to stop working,,,,",snapchat always stop,5
441,"tsunami warning for up to 10-foot waves issued for japan after quake off... by via,,,,",tsunami japan quake,11
442,"and we have won the world cup. 7th world cup for india kabaddi team and 3rd in a row.; abhi to party shuru hui hai.,,,,",world world cup india kabaddi team party,26
443,"breaking: another large earthquake (7.3) hits fukushima in japan. tsunami warning issued.;hoping everyone ok. be careful out there.,,,,",another large earthquake fukushima tsunami everyone,11
444,"any cuban followers? fidel castro died y'all. bless up,,,,",cuban fidel castro,2
445,"prefecture reports 18 dead and 60 hostages in the heart of #paris,,,,",prefecture dead heart,26
446,"too many fake narendra modis congratulating india on world cup victory !!,,,,",many india world cup victory,26
447,"alicia vikander was flawless in the danish girl. well deserved!,,,,",alicia vikander danish well,1
448,"sensational karun nair. incredible knock. and fantastic strike rate as well. what a knock,,,,",karun incredible fantastic strike,15
449,"crazy situation in paris. 26 reported dead in theater hostage situation.,,,,",situation dead hostage,26
450,"fidel castro is finally dead,,,,",fidel castro finally,2
451,"an earthquake with a preliminary magnitude of 7.3 has struck off the coast of fukushima prefecture in japan. a tsunami warning for waves,,,,",earthquake magnitude coast fukushima prefecture tsunami,11
452,"what a victory!! congrats team india. if someone says we don't play well outside india,,,,",congrats team someone play well outside,26
453,"well my snapchat isn't working wtf,,,,",well snapchat,5
454,"wow. alicia vikander is so pretty!,,,,",alicia vikander,1
455,"if you ever feel stupid,,,,",ever,26
456,"team india on a mission!,,,,",team india,26
457,"the takes about kaepernick's latest comments were so hot that they killed fidel castro. focused hot takes can do anything.,,,,",latest fidel,2
458,"turned on the news to see if #jihadijohn was really dead and see this in #paris ...these #terrorist attacks are getting too frequent.,,,,",news see really dead see,26
459,"yay! happy for alicia vikander. she did well in the danish girl.,,,,",happy alicia well danish,1
460,"i'm all for instant news but seeing pics of (presumed) dead under blankets in the street is upsetting for a lot of people #paris,,,,",news dead street lot people,26
461,"karun nair ended the calendar year with a double ton.,,,,",karun nair year double,15
462,"reports: coordinated violent incidents in #paris leave 18 dead,,,,",leave,26
463,"mashable: alicia vikander looks like a disney dream at the oscars,,,,",alicia vikander like disney dream,1
464,"yes! alicia vikander,,,,",alicia,1
465,"what a wave! re: the danish girl director waving to alicia vikander,,,,",danish girl alicia,1
466,"you don't realise how much you rely on snapchat until it stops working,,,,",realise much snapchat,5
467,"if alicia vikander doesn't win....idk what i'll do,,,,",alicia vikander,1
468,"trump won florida,,,,",trump,23
469,"if florida gets hit by another hurricane i won't bat an eye. i don't know them,,,,",florida hit another bat know,23
470,"why is snapchat not working,,,,",snapchat,5
471,"alicia vikander with her first of many!!!,,,,",alicia vikander first,1
472,"fidel castro's death is the end of en era.,,,,",fidel death end en,2
473,"26 people dead,,,,",people,26
474,"snapchat not working is such a struggle,,,,",snapchat,5
475,"what a year eh alicia vikander,,,,",year alicia,1
476,"18 reported dead and now hostages taken #paris #prayforparis,,,,",dead,26
477,"congractulations! team india won the kabaddi world cup 2016,,,,",team india kabaddi world cup,26
478,"japan braces for a tsunami holy crap?,,,,",japan tsunami holy,11
479,"kudos indian cricket team on the emphatic innings win &amp; taking series 4-0. wtg!,,,,",indian cricket team emphatic win series,26
480,"breaking: karun nair makes highest test score by an indian batsman against englandcricket.,,,,",karun nair highest test score indian batsman,15
481,"wow. the is reporting trump won florida. huge swing state.,,,,",trump,23
482,"lippi appointed as new china pr coach: former fifa world cup winning coach marcello lippi was on saturday app...,,,,",new former world cup,26
483,"karun nair should imagine bat as gun and shoot all english players after scoring 300.,,,,",karun nair bat gun shoot english,15
484,"***breaking news*** ;26 dead,,,,",,26
485,"i love when snapchat actually works xx,,,,",love snapchat actually,5
486,"my snapchat isnt working and my streak is in the line,,,,",snapchat streak,5
487,"yaaay triple century for karun nair seems like way to 1000 runs for india.,,,,",triple century karun nair like way,15
488,"ap: 7.3 magnitude strikes off coast of fukushima,,,,",magnitude coast,11
489,"snapchat not working is so annoying,,,,",snapchat,5
490,"""rt laurencedefrano: """"urgent #parisshootings 18 deads says the police. taking of hostages in concert hall bataclan"",,,,",concert hall,28
491,"snapchat not work. ;blame donald trump.,,,,",snapchat donald,8
492,"fidel castro was a great man,,,,",fidel castro great,2
493,"congrats team india win kabbadi world cup2016,,,,",congrats team india win kabbadi world,26
494,"airplane carrying brazilian football team crashes in colombia - see more at:,,,,",airplane brazilian football team colombia see,18
495,"paris shootings: live updates as at least 18 people dead following shooting and explosion in french capital,,,,",paris live least people dead explosion french,26
496,"is anyone's snapchat not working ?,,,,",snapchat,5
497,"there we heroes and then there was fidel castro!,,,,",fidel,2
498,"the great leader,,,,",great,24
499,"what a day it's been for karun nair and india,,,,",day karun nair,15
500,"congrats karun nair for his 300 runs achivment,,,,",congrats karun nair,15
501,"alicia vikander,,,,",alicia,1
502,"why is snapchat not workingggggg,,,,",snapchat,5
503,"why is alicia vikander so swarthy? she confuses me; i always think she's a redbone,,,,",alicia vikander always think,1
504,"26 people dead in paris attacks per the #fox25 #breaking,,,,",people dead paris,26
505,"""like &amp; rt if you came right to twitter and searched """"snapchat not working"""" to make sure you weren't the only one"",,,,",rt right make sure,5
506,"fidel castro;capitalism is using its money; we socialists throw it away.,,,,",fidel throw,2
507,"fidel castro is dead. you can take the socks off now,,,,",fidel castro take,2
508,"can't believe fidel castro died!!! hopefully he makes a full recovery,,,,",believe fidel castro hopefully,2
509,"#breaking: city of #paris,,,,",,26
510,"alicia vikander is swedish,,,,",alicia vikander,1
511,"[breaking] police: 26 dead after series of incidents in paris,,,,",dead series,26
