,text,preprocessed,cluster
0,"so fidel castro just died and now i'm seeing commies popping up everywhere lol,,,,",fidel castro,2
1,"11 dead 4 injured in paris shooting #paris,,,,",dead paris,26
2,"""congrats team india to win the test series """"4-0"""" against england..;now interesting to read tweet.."",,,,",team india win test series,26
3,"congratulations to all indians for winning kabadi world cup 2016,,,,",kabadi world cup,26
4,"earthquake sparks japan tsunami warning,,,,",earthquake japan tsunami,11
5,"proud of team india on winning kabaddi world cup,,,,",proud team india kabaddi world,26
6,"yo trump just won florida he might actually win,,,,",trump florida might actually,23
7,"rip fidel castro,,,,",rip fidel,2
8,"magnitude 7.3 earthquake strikes off fukushima in japan,,,,",magnitude earthquake fukushima,11
9,"alicia vikander is the whitest person in the room and still the most tan. how?,,,,",alicia vikander person still,1
10,"significant 7.3 magnitude earth quake near ne japan - tsunami imminent,,,,",magnitude quake near japan tsunami,11
11,"just won the state of florida!!! awesome,,,,",state,23
12,"disgusted that trump won florida,,,,",trump,23
13,"snapchats no working,,,,",snapchats,4
14,"karun nair scores a triple century,,,,",karun nair triple,15
15,"a win from a great woman for an important film. congratulations alicia vikander.,,,,",win great woman alicia,1
16,"chennai pitch is hiding karun nair's flaws.,,,,",chennai karun,15
17,"india kabaddi world cup champion 2016!!!,,,,",india kabaddi world cup champion,26
18,"former cuban president fidel castro dies at age 90,, president raul castro announces.,,",former cuban president fidel castro age president raul castro,2
19,"26 people now confirmed dead in paris. thoughts go out to the victims families &amp; friends.,,,,",people dead go,26
20,"my snapchat isn't working and its really making me mad.,,,,",snapchat really,5
21,"former cuban leader,,,,",former cuban,20
22,"fidel castro: can i live just one more day;god:,,,,",fidel live one,2
23,"fidel castro sucked but i'm ordering another beer for that 90 year old,,,,",fidel castro another year,2
24,"fidel castro died? now dale gribble aka can relax.,,,,",fidel castro,2
25,"congratulations to team india for winning the kabaddi world cup 2016,,,,",team india kabaddi world cup,26
26,"who else's snapchat isn't working ? or is it my shocking internet,,,,",snapchat,5
27,"did alicia vikander's publicist tell her to black up to get more screen time?,,,,",alicia black get,1
28,"fidel castro dies at 90,,,,",fidel castro,2
29,"congrats to indian cricket team for win match n series by 4-0,,,,",congrats indian cricket team win match n series,26
30,"single to karun nair,,,,",single karun,15
31,"fidel castro is dead! that's one dictator down,,,,",fidel castro one dictator,2
32,"congrats team india to won the kabaddi world cup.... proud to be an indian...,,,,",congrats team india kabaddi world proud,26
33,"alicia vikander totally deserves this award!! she gave a breath taking performance! congrats!!!,,,,",alicia vikander,1
34,"fidel castro of cuba is dead.,,,,",fidel castro cuba,2
35,"fidel castro died.;i wonder who is going to tell since he was defending him.;,,,,",fidel castro wonder since,2
36,"kabaddi world cup: india beat iran 38-29 to lift third straight title,,,,",kabaddi world india beat iran lift third,26
37,"this must seem like a beautiful dream for karun nair.,,,,",must seem like dream karun,15
38,"what a terrific match this is.. un believable bowling and extraordinary batting performance..hats up team india,,,,",match team,26
39,"the highest scores for india in tests against england: karun nair goes past virat kohli's 235 in mumbai;;,,,,",highest india karun nair past virat,15
40,"no tsunami threat to the us after a 6.9 earthquake off the east coast of japan...,,,,",tsunami earthquake coast,11
41,"""new post: """"tsunami warning issued in japan following 6.9 magnitude quake"""""",,,,",japan magnitude,11
42,"karun nair batting superbly. india have dominated the english. return series next year nicely poised. kohli was born a leader,,,,",karun nair india series next year kohli,15
43,"congrats india on winning the kabaddi world cup 2016,,,,",congrats india kabaddi world cup,26
44,"why isn't my snapchat working???,,,,",snapchat,5
45,"fidel castro jokes should be good.,,,,",fidel castro,2
46,"ap reporting at least 26 dead so far as a result from attacks in #paris,,,,",ap least dead far,26
47,"comprehensive series victory! way to go team india *in*,,,,",series way go team india,26
48,"supporting actress should be alicia vikander. she had a great year.,,,,",actress alicia great,1
49,"alicia vikander was good in the danish girl. idk if she was the best in the category though,,,,",alicia vikander good danish idk best,1
50,": evacuation underway- plane was carrying 1st division brazilian team ;,,,,",evacuation plane brazilian team,18
51,"fidel castro,,,,",fidel,2
52,"i wonder why cnn isn't projecting florida or georgia into their electoral count,,,,",wonder cnn florida,23
53,"i'd love to see alicia vikander or jennifer jason leigh take this.,,,,",love see alicia vikander jennifer jason leigh take,1
54,"i had total mandela effect for fidel castro. like,,,,",total mandela effect fidel,2
55,"sad news,,,,",sad,30
56,"snapchat not working for anyone else?,,,,",snapchat anyone,5
57,"sick and saddened over #paris. heart breaking. unconfirmed reports of 18 dead after explosion,,,,",sick heart dead,26
58,"fidel castro died. smdh. 2016 out here snatching chains.,,,,",fidel castro,2
59,"signed and framed northern ireland norman whiteside 1982 world cup photo,,,,",world cup,26
60,"snapchat isn't working. i blame trump.,,,,",snapchat blame,5
61,"florence henderson and fidel castro in 24 hrs of each-other.,,,,",florence henderson fidel castro,2
62,"everytime snapchat stops working,,,,",snapchat,5
63,"india - the kabaddi world cup champion 2016. congratulations indians and well played iran. ;,,,,",india kabaddi world cup champion well,26
64,"my snap chat stopped working and i started freaking out,,,,",snap chat,4
65,"kabaddi world cup: india beat iran to win third successive title: a stellar come-from-behind win for india as...,,,,",kabaddi world india beat iran win third successive win india,26
66,"looks like even england wants karun nair to reach 300 so that kohli declares the innings,,,,",like even england karun nair reach kohli,15
67,"i won't be going back to florida anytime soon,,,,",back florida,23
68,"congratulations of indian team for winning the 4-0 test series,,,,",indian team test,26
69,"lol if trump was the reason why snapchat ain't working im gonna throw a tantrum,,,,",lol trump reason snapchat im gonna throw,5
70,"congratulations india on winning the kabaddi world cup 2016,,,,",india kabaddi world cup,26
71,"sparkling 303 of rising star karun nair that too not out.heartiest congratulations3 cheers join the nation to salute &amp;celebrate,,,,",star karun nair join,15
72,"2016 is not safe for anybody. even fidel castro took that last trip.,,,,",safe even fidel castro last,2
73,"powerful 7.3-magnitude earthquake strikes off japan,,,,",powerful earthquake,11
74,"fidel castro dies at age 90 -,,,,",fidel castro age,2
75,"former cuban pm and president fidel castro's struggle has ended.,,,,",former cuban pm president fidel struggle,2
76,"unfortunately fidel castro's death will not change things for cuba but i am still very happy,,,,",fidel death change cuba still,2
77,"innalilahi;alfatihah qt long-time cuban leader fidel castro dies at age 90,,,,",cuban leader fidel castro age,2
78,"paris. 30,,26, 11 dead explosions hostages;;cue social media feeding frenzy, obviously this is proof of &lt;insert conspiracy theory&gt;",dead,26
79,"man in restaurant/bar in paris,,,,",man,26
80,"so the cubs won and fidel castro is dead.....you sucked 2016....but you delivered.,,,,",fidel castro,2
81,"i'll never forget the first time we saw alicia vikander naked,,,,",never first time alicia vikander,1
82,"alicia vikander for best supporting actress pleaseeee,,,,",alicia vikander best actress,1
83,"snapchat not working for anyone else?,,,,",snapchat anyone,5
84,"karun nair's 271* is the 5th best score for an indian batsman in tests going past dravid's 270;;,,,,",karun best score indian batsman past,15
85,"karun nair 261 and india 700/6,,,,",karun nair india,15
86,"only my snapchat thats not working?,,,,",snapchat,5
87,"mom: of course hillary won colorado,, at least florida is smart enough to got trump.;me: fuggoff,,",hillary least florida enough,23
88,"not even fidel castro could survive 2016,,,,",even fidel castro could survive,2
89,"rip fidel castro at 90,,,,",rip fidel castro,2
90,"colin kaepernick called a hypocrite by miami columnist for defending fidel castro,,,,",colin kaepernick fidel,2
91,"karun nair solid batting at chepauk ! i can see all dead englishmens karnataka bois finding easy at tamilnadu rare thing to see,,,,",karun nair see dead thing,15
92,"nice to see karun nair trying to match batting legends like jayant yadav;;,,,,",see karun nair match like,15
93,"latest french media reports 18 dead in paris attacks #paris #breakingnews,,,,",latest french dead paris,26
94,"fidel castro died. the only one who confronted imperialism.;,,,,",fidel castro one,2
95,"trump won in florida thanks to all the uneducated cuban-americans.,,,,",trump florida,23
96,"karun nair what an epic innings !! converted the first century into tripple (303*) !!;fabulous innings young man ;,,,,",karun nair first century young man,15
97,"no update on casualties after a plane carrying members of a top-flight brazilian football team crashed in colombia.,,,,",update plane brazilian football team,18
98,"why is snap not working???,,,,",snap,4
99,"actress in supporting role: i'm rooting for alicia vikander but kate winslet could take this idk this one was hard i really liked steve jobs,,,,",actress alicia vikander kate could take idk one hard really,1
100,"plane carrying 81 involved in accident in colombia,,,,",plane,18
101,"fidel castro has died. click link for more info:,,,,",fidel castro,2
102,"many congratulations to indian team for wining kabaddi world cup,,,,",many indian team kabaddi world,26
103,"26 confirmed dead in paris. hostages. ;;if this is who i think it may be - it is time to erase them.,,,,",dead think may time,26
104,"fidel castro is dead at 90.,,,,",fidel castro dead,2
105,"my snapchats are not working nooo,,,,",snapchats,4
106,"congratulations on your retirement,,,,",,34
107,"trump just won flordia :d,,,,",trump,23
108,"nothing in the world is irreversible, not even capitalism -fidel castro,,,",nothing world even,2
109,"tsunami warning issued after 7.3 magnitude earthquake in japan: via,,,,",tsunami magnitude earthquake,11
110,"so apparently fidel castro died... if he was watching this game i blame the turnovers.,,,,",fidel castro game blame,2
111,"(3e essai) i bet on alicia vikander,,,,",alicia,1
112,"trump won florida but that's not surprising,,,,",trump florida,23
113,"rip fidel castro;he was the real deal.,,,,",rip fidel real,2
114,"congratulations team india for 4-0 win over england in test series..,,,,",team india win england test,26
115,"outstanding knock by karun nair.. congratulations on reaching 300*,,,,",outstanding knock karun,15
116,"fidel castro,,,,",fidel,2
117,"fidel castro died doing what he loved,,,,",fidel castro,2
118,"according to several sources,,,,",several,26
119,"hope karun nair speaks to entire media today and not some obscure intvw 2 star is born.,,,,",hope karun nair entire today star,15
120,"wowww just heard about fidelcastro true revolutionary gbnf,,,,",true revolutionary,26
121,"sky news reporting 26 dead in paris. the majority killed at a restaurant. this is not over yet.,,,,",sky news dead,26
122,"dems complaining about johnson votes in florida can be said the same about virginia. wow. if johnson votes switched to trump,,,,",florida,23
123,"earthquake hits off coast of fukushima in japan; tsunami warning issued -,,,,",earthquake coast fukushima tsunami,11
124,"alicia vikander. i love you.,,,,",alicia love,1
125,"the last voice of developing world's socialism 'fidel castro' died. 'fidel you died but you alive in ideas'. man can dies but not idea.,,,,",last alive man,2
126,"cuban president raul castro has announced the death of his brother fidel castro on cuban state media.,,,,",cuban president raul castro death brother fidel castro cuban state,2
127,"england might not even come to visit india after this tour,,,,",england might even come india,26
128,"why is my snapchat not working???????,,,,",snapchat,5
129,"casually crying because alicia vikander deserves everything great in this world i love her so much,,,,",alicia vikander great world love,1
130,"tsunami warning for fukushima after strong earthquake hits japan,,,,",tsunami fukushima strong earthquake,11
131,"how long until donald trump takes credit for killing fidel castro?,,,,",long donald trump fidel,2
132,"alicia vikander should have hidden her android innards a little bit better than that...,,,,",alicia vikander android better,1
133,"ejo is snapchat working or what?...,,,,",snapchat,5
134,"whatttaaaa terrificccc performance from team india....india won ; 4-0,,,,",performance team,26
135,"fidel castro has died. i would say rip but he doesn't deserve that.,,,,",fidel castro would say rip deserve,2
136,"karun nair scores 300 against .;well done champ. :);join the 300 clubs :) ; ;congratulations :'),,,,",karun nair,15
137,"actress in supporting role: alicia vikander ;;excellent actress.,,,,",actress alicia vikander,1
138,"congratulations team india for fantastic win,,,,",team india fantastic,26
139,"another earthquake and tsunami in japan. s hit,,,,",another earthquake tsunami,11
140,"paris shooting: several dead as gunman opens fire in city,,,,",paris several dead gunman fire,26
141,"yeah trump won florida gg,,,,",trump florida,23
142,"take a bow,,,,",take,26
143,"yessssssssssssss,,,,",,26
144,"what an emphatic victory for the indian team. completely outplayed the englishmen. all the young guns fired and made it possible,,,,",emphatic victory indian young,26
145,"the media has spent billions trying to get me to hate fidel castro ever since i've been alive. he was loved by his people for decades.,,,,",get hate fidel castro ever since people,2
146,"alicia vikander winning this even though she was clearly a lead,,,,",alicia vikander even though,1
147,"a tsunami will occur in japan,,,,",tsunami,11
148,"plane carrying football players from brazil crashes in colombia: afp,,,,",plane football brazil,18
149,"four from karun nair takes him to 288 and india to 730/6...which is their highest test score!,,,,",four karun nair india highest test,15
150,"""i like how j.k. simmons didn't beat around the bush at all.... """"andthewinnerisaliciavikander"""""",,,,",like simmons beat around,26
151,"at least 18 dead in paris shootings: bfm tv: paris (reuters) - at least 18 people were killed in shootouts in ...,,,,",least dead paris paris least people,26
152,"fidel castro: a thorn in the side of the us,,,,",fidel,2
153,"karun nair is not affected with he has 3 100's ~ bhakt;,,,,",karun nair,15
154,"karun nair. you're truly something else. another breed of exception. hats off.,,,,",karun something another,15
155,"colombian authorities report plane carrying dozens has crashed near medellin - ap,,,,",colombian report plane near medellin,18
156,"fidel castro cause of death: how did the cuban president die?,,,,",fidel castro cause cuban president,2
157,"we all come on twitter to rant about how snapchat isn't working :),,,,",come snapchat,5
158,"congrts team india on a wonderful win.. 4-0;sir made this for us.. keep going on winning.. superb end to the year;,,,,",congrts team india wonderful keep superb end,26
159,"tsunami warning issued after 7.3-magnitude earthquake strikes japan,,,,",tsunami earthquake,11
160,"snapchat not working. i've gotta blame trump for this.,,,,",snapchat blame trump,5
161,"why isn't snap working ughhhhh,,,,",snap,4
162,"marvel's avengers are so fake. team india is the real avenger!! 4-0 defeat against england finally avenged,,,,",team india real defeat england finally,26
163,"plane reportedly carrying brazilian football team chapecoense crashes in colombia,,,,",plane reportedly brazilian football team chapecoense,18
164,"j.k. simmons so hyped. he's gonna get to kiss alicia vikander on the cheek tonight.,,,,",simmons gonna get alicia vikander,1
165,"he hated the u.s.,,,,",,26
166,"i hate when my snapchat doesn't work!!! ugh i need to add some new members,,,,",hate snapchat need new,5
167,"fidel castro just /finally/ died jfc.;;so 2016 was good for something.,,,,",fidel castro good,2
168,"news....magnitude 7.3 earthquake strikes off fukushima in japan,,,,",earthquake fukushima,11
169,"#breakingnews breake loos in #paris: 18 dead in terror #attacks!,,,,",dead terror,26
170,"trump won florida. i want to die now,,,,",trump want die,23
171,"trump supposedly just won florida,,,,",trump,23
172,"former cuban leader fidel castro has died at age 90,,,,",former cuban leader fidel castro age,2
173,"at least 18 reported dead in paris attacks via the android app,,,,",least dead paris via android,26
174,"anyone else's snapchat not working or is it just me,,,,",anyone snapchat,5
175,"one wonders the levels of spectacular alicia vikander could have achieved had she starred opposite tracy morgan.,,,,",one spectacular alicia vikander could,1
176,"deadly attacks reported in paris; at least 18 killed,,,,",deadly least,26
177,"fidel castro's death was announced by his brother cuban president raul castro on state media,,,,",fidel death brother cuban president raul castro state,2
178,"fidel castro was a very very bad man according to all the cubans out there,,,,",fidel castro bad man,2
179,"why isnt my snapchat working,,,,",snapchat,5
180,"snapchat why do you never work,,,,",snapchat never,5
181,"can someone explain to me why snapchat isn't working ??,,,,",someone snapchat,5
182,"paris (ap) - police: at least 11 dead in shootout,,,,",paris least dead,26
183,"""alicia vikander wins best supporting actress for """"the danish girl."""""",,,,",vikander best actress danish,1
184,"plane carrying brazilian soccer team to colombia crashes,,,,",plane brazilian soccer team colombia,18
185,"greta garbo and ingrid bergman would be so proud of alicia vikander!,,,,",would proud alicia,1
186,"india won 5th cricket test against england to take series 4-0,,,,",india cricket test england take series,26
187,"now alicia vikander has won i can sleep,,,,",alicia vikander,1
188,"fidel castro was a hero to some and a villain to millions more. true change for cuba has a long way to go. sadly it still depends on regime.,,,,",fidel castro hero true change cuba long way still,2
189,"two of india's best kohli and ashwin didn't have any impact still india defeats england by such a margin..;complete team display!!;,,,,",best kohli still india england team,26
190,"deadly attacks reported in paris; several killed in explosions,,,,",deadly several,26
191,"i have the worst crush on alicia vikander,,,,",alicia,1
192,"""just in&gt;&gt; """";tsunami warning issued after 7.3-magnitude earthquake strikes off fukushima in japan; """" ;"",,,,",earthquake fukushima,11
193,"fidel castro dead at 90: cuban tv. 90. after all that. definite historical phenomenon,,,,",fidel castro dead cuban historical,2
194,"congratulations to the amazing alicia vikander!,,,,",alicia,1
195,"at least ten dead from a shooting near the bataclan in paris;;,,,,",least dead near,26
196,"karun nair becomes india's second triple centurion in tests after sehwag. this landmark eluded even gavaskar,,,,",karun nair triple even,15
197,"paris news outlets reporting at least 26 dead amid shootings and explosion at three sites. prayers for paris. #parisstrong,,,,",paris news least dead explosion three,26
198,"is anyone else's snap not working?,,,,",anyone snap,9
199,"fidel castro has died aged 90,,,,",fidel castro,2
200,"congrats. team india it's historical win proud of you all,,,,",team india historical win proud,26
201,"is fidel castro actually dead or,,,,",fidel castro actually dead,2
202,"breaking: cuban state-run television announces fidel castro died at 7pm local time today. he was 90 years old.,,,,",cuban television fidel castro local time,2
203,"former cuban president &amp; leader of communist revolution fidel castro died aged 90. he ruled cuba as a one party state for almost 5 decades,,,,",former cuban president leader communist revolution fidel castro cuba one party state almost,2
204,"what a performance! what a match!! what a series!!! 's team india ruthlessly thrashes england 4-0,,,,",team india england,26
205,"see,,,,",,19
206,"karun nair ......... see you in indian team till 2019 ! 300* is enough .;well played .,,,,",karun nair see indian team enough,17
207,"the latest on the #paris attacks coming up on the at ten. french police say at least 11 people dead;#newsatten,,,,",latest french police say least people,26
208,"fidel castro must have gone too hard in the paint on this,,,,",fidel castro must hard,2
209,"damn finally fidel castro died man after such a long time,,,,",damn finally fidel castro man long,2
210,"trump just won florida. its over guys.,,,,",trump,23
211,"just heard there's been a big earthquake in japan &amp; a tsunami warning. i hope &amp; jane are ok? safe travels! xxx,,,,",big earthquake japan tsunami hope safe,11
212,"the cuban's media has announced that fidel castro is dead at the age of 90,,,,",fidel castro dead age,2
213,"tsunami warning issued after quake off fukushima in japan,,,,",tsunami quake fukushima,11
214,"karun nair hits tripple-century and becames 2nd player to hits 300+ from india after,,,,",karun nair player india,15
215,"i hate when snapchat doesn't work,,,,",hate snapchat,5
216,"unbeaten 303 runs by karun nair,,,,",unbeaten karun,15
217,"trump officially just won florida,,,,",trump,23
218,"congrats team india for winning. well played. we are all very proud of you.,,,,",congrats team india well proud,26
219,"i've never lived in a world where fidel castro didn't rule cuba.,,,,",never world fidel castro rule,2
220,"300! unreal. 759-7 and a declaration. take many bows,,,,",take many,26
221,"indian cricket team really deserves compliments for the grand victory over england with records. bravo..,,,,",indian cricket team really victory england,26
222,"that moment when i look up fidel castro literally 2 days ago and he suddenly dies today.,,,,",moment look fidel castro literally ago,2
223,"honestly thought fidel castro died like three years ago.,,,,",thought fidel castro like three,2
224,"quake followed by tsunami concerns in japan:,,,,",quake tsunami,11
225,"this!;japan tsunami warning after earthquake off the coast of ;;,,,,",tsunami earthquake coast,11
226,"french police reporting minimum of 3 attacks in paris. reports at least 18 people dead in one attack at a restaurant.,,,,",french police least people dead one attack,26
227,"why isn't my snap working,,,,",snap,4
228,"tsunami warning issued after japanese earthquake,,,,",tsunami japanese,11
229,"independent: tsunami warning issued after 6.9 earthquake strikes japan,,,,",tsunami earthquake,11
230,"the election is over. trump won florida,,,,",election trump,23
231,"i knew alicia vikander would be great after ex machina! congrats!,,,,",alicia vikander would great ex,1
232,"30 dead in paris.. what is happening #paris,,,,",dead,26
233,"kabaddi world cup final: india beat iran to win third successive title.,,,,",kabaddi world cup india beat iran win third successive,26
234,"that will be a lot of work to carry each one of em out of the plane. handling mannequin can be troublesome tho.,,,,",lot work carry one,26
235,"26 dead in paris official per paris police.,,,,",dead paris official paris,26
236,"breaking : several feared dead as kalashnikov-wielding gunman goes on the rampage in central paris...18 dead...,,,,",several dead gunman central,26
237,"cuba's fidel castro dies aged 90,,,,",fidel castro,2
238,"great hero of communism fidel castro is no more. r.i.p,,,,",great hero fidel castro,2
239,"japan 'the most prepared place in the world' for a tsunami via fwiw,,,,",japan place tsunami via,11
240,"i think snapchat not working has had a bigger reaction than trump today,,,,",think snapchat trump,5
241,"alicia vikander deserved that so much,,,,",alicia vikander,1
242,"every single by karun nair make my heartbeat higher ,,,,",every single karun nair make,15
243,"police: 18 people dead after multiple attacks in paris; more casualties expected -,,,,",people dead multiple,26
244,"ajay thakur has arguably won india the world cup single handedly. brilliant!,,,,",ajay thakur india world cup single,26
245,"congrats for team india wining the series with 4-0,,,,",congrats team india series,26
246,"'at least 18 dead' as gunmen open fire,, reports say hostages held,,",least open say,26
247,"now 26 dead,,,,",,26
248,"i know his memory will live on,, but this is such a hard blow. que decanses en paraiso comandante fidel castro,,",know live hard en fidel,2
249,"snapchat can you work please,,,,",snapchat work,5
250,"breaking news: 3-meter tsunami expected in parts of japan following powerful earthquake.,,,,",tsunami japan powerful,11
251,"tsunami warning after strong earthquake hits japan - sky news,,,,",tsunami strong earthquake japan sky,11
252,"are we all ok agreeing that alicia vikander's best supporting actress award is really for ex machina? agreed.,,,,",ok alicia best actress award really ex,1
253,"many congratulations to team india 4-0 straight win against england and kohli u really rock,,,,",many team india win england kohli u really,26
254,"what a special innings by a guy who has been waiting in the wings for a long time now.. take a bow karun nair,,,,",special guy long time take bow karun,15
255,"pope francis meets with fidel castro,,,,",fidel,2
