,text,preprocessed,cluster
512,"marxist fidel castro dies at 90. imagine america will declare castro a hero like nelson mandela. mandela wrote...,,,,",fidel castro america declare castro hero like mandela,2
513,"only sehwag ahead of karun nair.,,,,",sehwag karun,15
514,"alicia vikander wins for best supporting actress for the danish girl :),,,,",alicia vikander best actress danish girl,1
515,"congratulations team india on wonderfull series sweep out on england,,,,",team india series sweep,26
516,"superb performance team india.. well done..keep it up..,,,,",superb performance team well,26
517,"fidel castro was an evil in our world. you're supposed to respect the dead,,,,",fidel castro,2
518,"plane carrying brazilian football team has reportedly crashed in colombia. details to come,,,,",plane brazilian football team reportedly,18
519,"hurray win last match too.sir jadega made it possible.many 2 congratulations to team india.,,,,",win last match team,26
520,"happening in paris;&gt;18 dead;&gt;2 blast;&gt;3 separate shooting locations;&gt;hostages taken 2 concert hall;;#refugeeswelcome unavailable for comment,,,,",concert,26
521,"karun nair scores 300,,,,",karun nair,15
522,"am i the only person thinking that it would have been better if kohli declared after karun nair cross 319..,,,,",person would better kohli karun nair cross,15
523,"oh my dear fidel castro gone...,,,,",oh dear fidel castro,2
524,". power m7.3 earthquake strikes fukushima area of japan,,,,",power earthquake fukushima area,11
525,"does go to fidel castro funeral and does he take ?,,,,",go fidel castro take,2
526,"cuba's fidel castro dies aged 90,,,,",fidel castro,2
527,"what an innings karun nair. who would have thought he would score 300 ? congrats on this great feat.,,,,",karun would thought would score congrats great,15
528,"india wins the test against england congrats virat and team,,,,",india test england congrats virat,26
529,"breaking: police: at least 26 dead in violence around paris,,,,",least dead violence around,26
530,"tsunami warning issued for japan after earthquake strikes off fukushima,,,,",tsunami japan earthquake,11
531,"karun nair going to create another history..near to 300 ... what say ..he is after you...,,,,",karun nair create another say,15
532,"why is my snapchat not working kms,,,,",snapchat,5
533,"hate what i'm hearing from paris. r.i.p. to the dead. :-(,,,,",hate,26
534,"anyone else snapchat not working?,,,,",anyone else snapchat,5
535,"triple century off 380 balls for karun nair 2nd batsman to reach the milestone after sehwag in 2005,,,,",triple century karun nair batsman reach sehwag,15
536,"300 for karun nair - what an achievement - could beat sehwag's 319,,,,",karun nair achievement could beat,15
537,"karun nair is on 295*. exactly the number of minutes afridi has batted in his entire career,,,,",karun nair number entire,15
538,"can't believe #jihadijohn has only been dead 8 hours and turned up in paris,,,,",believe dead,26
539,"congrats team india. india won the kabbadi world cup...,,,,",congrats team india kabbadi world,26
540,"congrats team india for a ruthless and absolutely dominating 4-0 win!,,,,",congrats team india absolutely,26
541,"congratulations karun nair on the,,,,",karun nair,15
542,"congratulations to the entire team hard/smart working individuals i can't lie,,,,",entire team,13
543,"breaking: several dead in shootings in paris,,,,",several dead,26
544,"even fidel castro couldn't take a trump presidency.,,,,",even fidel castro take trump,2
545,"snapchat isn't working... i'm very upset:/,,,,",snapchat,5
546,"best supporting actress: i think it should be brie larson but if alicia vikander got it then it's definitely deserved.;,,,,",best think brie larson alicia vikander,1
547,"fidel castro,,,,",fidel,2
548,"best supporting actress is...alicia vikander!!!!!!!! yes!,,,,",best actress,1
549,"end of an era fidel castro has died breaking news!,,,,",end fidel castro,2
550,"my snap chat acting up. work about to be dead,,,,",snap chat work,26
551,"supporting actress 2016 winner is alicia vikander from,,,,",actress winner alicia vikander,1
552,"reuters: rt reutersworld: more: tsunami to strike fukushima coast within minutes - japan broadcaster nhk,,,,",rt tsunami strike fukushima coast japan broadcaster,11
553,"liam neeson will be perfect for fidel castro biopic.,,,,",fidel castro,2
554,"is praising fidel castro right now? i'm not sure what the point of this feature is...,,,,",fidel castro right sure point,2
555,"multiple attacks in paris now;shootings and explosions;so far 18 dead expected to rise ;possible hostages #parisattack,,,,",multiple paris far dead rise,26
556,"proud to be indian! well done to kohli and the indian team for a magnificent series!,,,,",proud well kohli indian team magnificent,26
557,"sure,, but the cia's secret plan to kill fidel castro via old age has come to fruition.,,",plan kill fidel castro via old age come,2
558,"alicia vikander would not have this award if it wasn't for eddie redmayne.,,,,",alicia vikander would award,1
559,"breaking: 18 dead in central paris terrorist attack friday night; additional casualties reported.,,,,",dead central paris terrorist attack,26
560,"castro kaput! there are enough despots running the world fidel,,,,",castro enough world,2
561,"no debate. it's 4-0 congrats team india,,,,",congrats team,26
562,"update,,,,",,26
563,"watch: karun nair celebrates his maiden double hundred for india..,,,,",karun nair maiden double hundred,15
564,"fidel castro has died at age 90,,,,",fidel castro age,2
565,"only thing left for sir to do now is to run karun nair out to neatly bookend karun's series.,,,,",thing sir run karun nair,15
566,"when i want to talk to someone the most,,,,",want talk someone,26
567,";several reportedly dead after paris shootings and explosions; connection unknown,,,,",reportedly dead paris connection,26
568,"fidel castro died has died... on our way to versailles for croquetas and celebration.,,,,",fidel castro way,2
569,"tsunami warning issued after 7.3 magnitude quake in japan; residents urged to flee fukushima coast - b...,,,,",tsunami magnitude quake fukushima coast,11
570,"fidel castro is dead,, and the eurocratic union is crumbling. 2016 was a great year.,,",fidel castro great,2
571,"congrats india! that was a humiliating defeat to eng when it seemed the match will be drawn! ;all round team effort in the series!,,,,",congrats defeat eng match team effort,26
572,"friendly reminder that if you have no connection to fidel castro,,,,",connection fidel,2
573,"is anyone else's snapchat not working ????,,,,",anyone snapchat,5
574,"rt scoopwhoopnews: england are getting pummeled in chennai! karun nair is going all guns blazing,,,,",rt england karun nair,15
575,"2016: alicia vikander wins best supporting actress for,,,,",alicia vikander best actress,1
576,"india wins kabbadi world cup. its a team effort. ajay thakur,, nitin tomar and surjeet, you were the real heros,",india kabbadi world team ajay real,26
577,"whys my snap not workinggggggggg,,,,",snap,26
578,"snapchat is not working and i'm about to lose a 159 day streak.,,,,",snapchat lose day,5
579,"there have been reports of shootings,,,,",,26
580,"celebrating india's win in kabaddi world cup. well done team india,,,,",win kabaddi world well team,26
581,"rip fidel castro,,,,",rip fidel,2
582,"india won by innings and 75 runs...congrts team india,,,,",india team,26
583,"japanese broadcaster nhk now reports the tsunami has been seen 20km from the coast.,,,,",japanese broadcaster nhk tsunami,11
584,"that was a splendid performance from team india,,,,",performance team,26
585,"snapchat not working is making me realize how much i use it....,,,,",snapchat realize much use,5
586,"world cup champions that sounds awesome mighty proud,,,,",world cup awesome,26
587,"can't believe fidel castro ruled over cuba for such a long time! power never leaves people's hands easily,,,,",believe fidel castro cuba long power never,2
588,"lmao the fact that i literally said a week ago fidel castro needed to go and he did today .. bruh,,,,",fact literally week ago fidel castro go today,2
589,"karun nair took just 75 balls to reach 300 from 200. virender sehwag-esque!,,,,",karun nair reach,15
590,"upto 26 dead in paris &amp; 60;hostages....pray for paris. a night of terror in paris,,,,",dead paris night terror,26
591,"breaking news &gt;&gt;&gt;&gt;multiple terror attacks in paris !! explosions,,,,",news terror paris,26
592,"i'm not mad at that alicia vikander was spectacular in the danish girl,,,,",alicia vikander spectacular danish,1
593,"karun nair 250* fab innings by an young playrr,,,,",karun nair young,15
594,"congratulations team india and to the captain and team ;4-0 score level ;,,,,",team india team score,26
595,";j k simmons announces best supporting actress award- alicia vikander for the danish girl;;,,,,",k simmons best actress alicia vikander danish,1
596,"cnn reporting 18 dead in 2 restaurant and bar near a stadium attacks in paris this evening.,,,,",cnn dead restaurant near stadium paris,26
597,"me finding out fidel castro died,,,,",fidel castro,2
598,"didn't see danish girl,, so that's cool.,,",see danish,19
599,"ajay thakur is really a hero ..typical patriot who is lifting india up today ..top raider of the world cup...we r proud of u ajay,,,,",ajay thakur really hero india today world r proud u,26
600,"three hundred to karun nair,,,,",three hundred karun,15
601,"i love my india thak all of team,,,,",love india,26
602,"it's pretty disturbing to see so many ppl upset and sad about the news of fidel castro dying. do you realize what he did to many cubans?,,,,",pretty see many ppl upset sad news fidel castro realize many,2
603,"japan earthquake: 7.3 magnitude quake strikes off fukushima - tsunami warning issued via,,,,",japan magnitude quake fukushima tsunami,11
604,"trump just won florida and i just saw my life flash before my eyes.,,,,",trump florida life,23
605,"what a victory what a finish... what a finish. congrats team india for remarkable test victory over team england,,,,",victory congrats team india test victory team,26
606,"breaking: cuban tv announces the death of long-time leader,, at age 90, reports,",cuban tv death age,33
607,"looks like fidel castro has died,,,,",like fidel castro,2
608,"i bet all the people tweeting rip fidel castro right now couldn't nam 5 of his songs.,,,,",people rip fidel castro right,2
609,"250 for karun nair. how many times he'll trouble people in the pavilion to stand up and applaud?,,,,",karun many people stand,15
610,"i cannot believe fidel castro is dead,,,,",believe fidel castro,2
611,"when my snapchat isn't working and neither is anyone else's,,,,",snapchat anyone,5
612,"karun nair scores maiden test triple ton after reaching triple figures for the 1st time in his 3rd test against at chennai,,,,",karun nair maiden test triple ton triple time test,15
613,"find out what car travelled to the world cup final in,,,,",find world cup final,26
614,"karun nair is racing towards a triple as india pile on their highest total in test history ;;,,,,",karun nair triple india highest total test history,15
615,"if i loose my 314 day streak with because snapchat isn't working i'm gonna cry,,,,",day streak snapchat gonna,5
616,"congrats team indian 4 giving us a happiness 2 win d series by margin of 4-0 .jeet ho 2 aaisi warna na ho..,,,,",congrats team indian win series ho,26
617,"tsunami warning issued after quake off fukushima in japan,,,,",tsunami quake fukushima,11
618,"wohooo that is another world cup... go team india.... ajay thakur hero,,,,",another world go team ajay thakur,26
619,"nah man i thought fidel castro would live forever.,,,,",man thought fidel castro would live,2
620,"karun nair is on fire,,,,",karun nair,15
621,"anti-american wore a fidel castro shirt at a press conference,,"" take a """"colon"""""",,",fidel castro take,2
622,"karun nair has been batting for 378 deliveries,,,,",karun nair,15
623,"magnitude 7.3 earthquake strikes off fukushima in japan,,,,",magnitude earthquake fukushima,11
624,"tsunami warning issued after quake off fukushima in japan,,,,",tsunami quake fukushima,11
625,"fidel castro couldn't handle donald being president. r.i.p,,,,",fidel castro handle donald,2
626,"paris: police say 18 dead. reports of shootings &amp; explosions,,,,",police say,26
627,"congratulations team india ;what a victory...;what a team and capacity.;virat ...you beauty.;way to go boys,,,,",team india team go,26
628,"the cuban ppl have lost an iconic ldr but the core of the revolution is embedded in their very being. rip fidel castro.,,,,",cuban ppl revolution rip fidel,2
629,"surely the grilled cubano will be special of the day saturday at ; in ;fidel castro,,,,",special day,2
630,"brevo....congret... indian teem for won kabbadi world cup,,,,",indian kabbadi world,26
631,"lol why is snapchat not working,,,,",lol snapchat,5
632,"bye bye mr fidel castro. very remarkable political icon of 20th century.,,,,",bye bye fidel icon,2
633,"fidel castro is dead. a pity the tyrant never met justice in this world. good riddance. hopefully someday soon we can toast to a free cuba.,,,,",fidel castro never good hopefully,2
634,"about time fidel castro died.,,,,",time fidel castro,2
635,"he just won florida wohu,,,,",florida,23
636,"a close field of contenders for this year's best supporting actress - alicia vikander has taken the statue.,,,,",close best actress alicia vikander,1
637,"year ends on a high note.;congratulations team india.,,,,",year high team,26
638,"oscars 2016 red carpet sees nominees brie larson and alicia vikander lead the glamour: the stars,,,,",red carpet brie larson alicia vikander lead,1
639,"what a time to come home to see bat &amp; hit 300 runs !! what a knock!! congratulations karun nair!!,,,,",time come see bat hit karun,15
640,"alicia vikander is a fantastic actor in every movie she's in and she deserves this. no complaints.,,,,",alicia vikander fantastic every movie,1
641,"my generation learned to hate fidel castro.,,,,",hate fidel,2
642,"honestly i'm so happy alicia vikander is getting recognition,,,,",happy alicia vikander,1
643,"meet karun nair,,,,",meet karun,15
644,"ummm is my snapchat the only one not working?!,,,,",snapchat one,5
645,"watching news of the magnitude 7.3 earthquake in fukushima,,,,",news magnitude earthquake,11
646,"cuba's fidel castro,, dies aged 90,,",fidel,2
647,"i love alicia vikander! &lt;3 glad she won. jennifer jason leigh deserved it too in my opinion though :(,,,,",love alicia glad jennifer jason leigh though,1
648,"japan earthquake: 7.3 magnitude quake strikes off fukushima - tsunami warning issued via,,,,",japan magnitude quake fukushima tsunami,11
649,"japan earthquake today: 7.3-magnitude hits near fukushima,,,,",japan earthquake near,11
650,"is fidel castro actually dead this is unreal,,,,",fidel castro actually dead,2
651,"fidel castro is dead,,,,",fidel castro,2
652,"why isn't my snapchat working like please don't do this to me,,,,",snapchat like please,5
653,"india won kabbadi world cup 2016 beating iran by 38-29 ....pakistan murdabad ... ha ha,,,,",india kabbadi world cup iran,26
654,"why black americans love fidel castro via,,,,",black love fidel castro,2
655,"fidel castro dies aged 90 ,,,,",fidel castro,2
656,"2016 so savage,,,,",,21
657,"colombian authorities report plane carrying dozens has crashed near medellin - ap,,,,",colombian report plane near medellin,18
658,"india won the kabadi world cup 2016.,,,,",india kabadi world cup,26
659,"india lifts kabbadi world cup beats iran,,,,",india kabbadi world cup,26
660,"longtime former leader and revolutionary icon fidel castro has died aged 90,,,,",former leader revolutionary icon fidel castro,2
661,"karun nair,,,,",karun,15
662,"and the goes to alicia vikander (reparto) the danish girl.,,,,",alicia vikander danish,1
663,"pray for japan they just had an earthquake hope they don't have another tsunami,,,,",pray japan earthquake hope another,11
664,"any particular reason why snapchat is not working?,,,,",reason snapchat,5
665,"at least 18 dead in paris shootings: bfm tv: paris (reuters) - at least 18 people were killed in shootouts in ...,,,,",least dead paris paris least people,26
666,"god damn it: 18 dead in paris,,,,",god damn dead,26
667,"globe and mail: at least 26 dead after restaurant shootouts,,,,",least dead restaurant,26
668,";what a talent--karun nair scores 300 plus against england at chennai.,,,,",nair england,15
669,"( french president hollande holds emergency mtg after deadly attacks,,,,",french president deadly,26
670,"incredible win for indian cricket team. well done boys! great effort,,,,",incredible win indian cricket well great,26
671,"fidel castro died today at the age of 90. holy crap.,,,,",fidel castro today age holy,2
672,"triple ton for karun nair... congrats....u r now next to viru paaji....,,,,",triple ton karun r next,15
673,"india wins kabaddi world cup 2016.;super proud moment,,,,",india kabaddi world cup proud,26
674,"who would have thought at stumps yesterday that karun nair gonna score a triple century today? big big congratulations.,,,,",would thought karun nair gonna score triple century big big,15
675,"plane reportedly carrying brazilian football team chapecoense crashes in colombia,,,,",plane reportedly brazilian football team chapecoense,18
676,"i merked zombies with that man. rip fidel castro.,,,,",rip fidel,2
677,"congratulations india kabaddi team to be the winner of kabaddi world cup.;well played,,,,",india kabaddi team winner kabaddi world,26
678,"tsunami warning after 7.3 earthquake hits japan via,,,,",tsunami earthquake japan,11
679,"fidel castro dead: cuban revolutionary leader dies at 90 via,,,,",fidel castro cuban revolutionary leader,2
680,"i love when snapchat doesn't work,,,,",love snapchat,5
681,"""news anchor said """"fidel castro is finally dead"""""",,,,",castro finally,2
682,"congratulation... ;;team india kapadi...;; won the world cup 2016 ;;,,,,",india world cup,26
683,"when you were literally just talking about fidel castro dying today and then it happens,,,,",literally fidel castro today,2
684,"wasn't alicia vikander in a vetter movie this year? she should have won for ex machina.,,,,",alicia vikander movie ex,1
685,"india are the world champs in kabaddi. india beat iran in kabaddi world cup finals . what a champion performance.,,,,",india world india beat iran kabaddi world cup champion,26
686,"india win ..what a great achievment team india ...,,,,",india win great team india,26
687,"well deserved for alicia vikander!,,,,",well alicia,1
688,"alicia vikander. the next big thing.,,,,",alicia next big,1
689,"reports: plane carrying copa sudamericana finalist chapecoense crashes in colombia,,,,",plane chapecoense,18
690,"and just like that,,,,",like,26
691,"no.1 bowler ashwin took only one wicket! no.2;batsman scored only 15 runs! still no.1 team india;manage to win the test by an innings!,,,,",one still team win test,26
692,"m7.3 hit japan 5:56am tuesday,,,,",hit japan,11
693,"congrats alicia vikander!!!! you were my favorite! ;,,,,",congrats alicia,1
694,"with this earthquake,,,,",,11
695,"the goat fidel castro couldn't even survive 2016.,,,,",fidel castro even survive,2
696,"plane carrying brazilian soccer team crashes in colombia,,,,",plane brazilian soccer team,18
697,"cuban president raul castro has announced the death of his brother fidel castro,,,,",cuban president raul castro death brother fidel,2
698,"san francisco mourning death of fidel on castro st. with candle light vigil.,,,,",death fidel castro,2
699,"so fidel castro is dead,,92, is breathing and ruling !,",fidel castro,2
700,"florida is off of the table. he basically won fl. michigan is our focus rn.,,,,",florida,23
701,"plane carrying brazilian football team chapecoense crashes in colombia,,,,",plane brazilian football team chapecoense,18
702,"plane carrying football players from brazil crashes in colombia,,,,",plane football brazil,18
703,"wtf plane carrying a soccer team crashes... not being biased to the other ppl. hopefully they are all fine .,,,,",wtf plane soccer team hopefully,18
704,"""when you type """"snapchat not working"""" just to make sure you're not the only one struggling"",,,,",make sure one,5
705,"#alert paris police: at least 14 dead,,,,",paris least,26
706,"me: ok i'll start my homework now; no excuses like the last 100 times.;;*fidel castro dies*;;*doesn't touch homework until 11:30pm sunday*,,,,",ok start like last castro,2
707,"mag-7.3 quake strikes japan; tsunami warning issued,,,,",quake tsunami,11
708,"historical 'karun nair' scored triple century became 2nd indian cricketer who scored 300 in test.,,,,",historical triple century indian,15
709,"magnitude 7.3 earthquake strikes off fukushima in japan,,,,",magnitude earthquake fukushima,11
710,"if you can't handle me at my fulgencio batista,,,,",handle,26
711,"congrats to karun nair,,,,",congrats karun,15
712,"at least 18 dead after #shootings,, afp says,,",least dead afp,26
713,"fidel castro died? i legit thought he died a few years ago and his brother was running the show on his behalf...,,,,",fidel castro thought ago brother show,2
714,"18 dead in paris... (french media reports),,,,",dead,26
715,"wowowowow i hate to inform yall that my uncle fidel castro just died,,,,",hate fidel castro,2
716,"and there it is! soak it all up karun nair. this is beyond amazing.,,,,",karun,15
717,"lmao mint snapchat is working x,,,,",snapchat,5
718,"magnitude 7.3 earthquake hit the coast of fukushima prefecture in japan at 5:50 am on november 22nd. ;;tsunami warning is alarming now.,,,,",magnitude earthquake hit coast fukushima prefecture japan,11
719,"japan earthquake today: 6.9-magnitude hits near fukushima,,,,",japan earthquake near,11
720,"is anyone else's snapchat not working,,,,",anyone snapchat,5
721,"cuba's former leader fidel castro has died aged 90,,,,",former leader fidel castro,2
722,"dzmm: plane carrying brazilian football team reportedly crashed with 89 on board. lord have mercy on them,,,,",plane brazilian football team reportedly,18
723,"congratulations team india defeating england in 4th test at chennai done excellent performance.,,,,",team india england test chennai excellent,26
724,"trump won florida? this might actually happen...,,,,",trump might actually,23
725,"triple century by karun nair in only his 2nd test match! some achievement,,,,",triple century karun nair test,15
726,"its all over team india won by innings &amp; 75 runs against england &amp; won 5 match test series 4-0.,,,,",team india england match test series,26
727,"colombian authorities report plane carrying dozens has crashed near medellin - ap,,,,",colombian report plane near medellin,18
728,"donald trump just won florida and is almost guaranteed to be president,,,,",donald trump florida almost,23
729,"karun nair goes past vvs laxman's 281. now only sehwag has scored more runs in an inns for india.,,,,",karun nair past sehwag,15
730,"alicia vikander is swedish. as i am. so i know that our kind does not tan naturally like that.,,,,",alicia vikander know like,1
731,"if everyone who voted for gary &amp; jill voted for hillary she would have won florida .....,,,,",everyone hillary would florida,23
732,"breaking news police : 3 attacks in paris,,,,",news police,26
733,"incredible win for team india..;from 130/0 to 207 all out.. and jadeja the reason.. ;,,,,",incredible win team jadeja,26
734,"florida is blue in that pic rt may i remind u guys this was obama vs romney and obama won,,,,",florida rt may u obama obama,23
735,"congratulations indian kabaddi team for winning 2016 kabaddi world cup!!,,,,",indian kabaddi team kabaddi world,26
736,"breaking: donald trump has won florida,,,,",donald trump,23
737,"prayers for paris,, attacks in perhaps three different areas, gunfire and...,",three different gunfire,26
738,"report: fidel castro dies at age 90,,,,",fidel castro age,2
739,"why does snap always quit working when i'm tryna message people,,,,",snap always,4
740,"i personally never seen fidel castro to be a bad guy,,,,",never fidel castro bad,2
741,"karun nair brings up his triple century,, he was dropped on 34 by cook.,,",karun nair triple,15
742,"breaking: plane carrying 81 people from brazil has crashed in colombia,,,,",plane people brazil,18
743,"alicia vikander was awesome! my 1st prediction,,,,",alicia vikander,1
744,"don't realise how much i use snapchat until it doesn't work,,,,",realise much use snapchat,5
745,"dunno why i'm so bothered about snapchat not working,,,,",snapchat,5
746,"shocked to hear about plane crash carrying football players from lets pray for everyone.,,,,",hear plane crash football pray,18
747,"watch the live coverage from japan following the major earthquake and possible tsunami.,,,,",watch live japan major earthquake possible,11
748,"breaking: former cuban dictator fidel castro has died at 90.,,,,",former cuban dictator fidel castro,2
749,"best supporting actress goes to alicia vikander,,,,",best actress alicia,1
750,"actually mind blown that trump won florida its nothing but spanish people here,,,,",actually trump florida nothing people,23
751,"and the oscar for goes to ... alicia vikander for,,,,",oscar alicia vikander,1
752,"this indian test team is set to push limits,,turn the tables &amp; extract wins no matter what!,,",indian test team,26
753,"unbelievable kid karun nair ,,,,",karun nair,15
754,"karun nair is going to break viru pa's record in sometime,,,,",karun nair break record,15
755,"congratulations to indian kabaddi team winning world cup,, proud to be an indian,,",indian kabaddi team world proud,26
756,"""i heard """"donald won florida"""" and i burst out into tears y'all."",,,,",,23
757,"washpost and bbc disagree which castro has died. wapo says raul and bbc says fidel. accuracy vs speed,,,,",bbc castro raul bbc,2
758,"is anyone else's snapchat not working? or just mine,,,,",anyone snapchat,5
759,"deadly shooting,,,,",deadly,27
